{
  "schema_version": "virtengine.core-rc.prototype/v0",
  "manifest_id": "T4-08A",
  "status": "dependency_blocked",
  "authoritative": false,
  "planned_functionality_complete": false,
  "milestone_m_eligible": false,
  "source": {
    "payload_sha": "20009d628265306cb1aa81c2215fd62f540ef4bd",
    "tree": "4ea376794e08e0d88182d0b8fc0e51eb9abeaee1",
    "branch": "ve/prototype-integration",
    "binding": "declared_clean_parent_payload"
  },
  "tooling": {
    "tooling_sha": "20009d628265306cb1aa81c2215fd62f540ef4bd",
    "tree": "4ea376794e08e0d88182d0b8fc0e51eb9abeaee1",
    "artifacts": [
      {
        "id": "generator",
        "path": "scripts/generate-core-rc-manifest.cjs",
        "git_blob": "4e886d7bb80bfbc8d71823f37b5f9c6db237ffd9",
        "sha256": "b59e56c67efa1585f5203bb7bcd9bcb81e22b3af123d835f76bc98b6e5e3a043"
      },
      {
        "id": "schema",
        "path": "_docs/ralph/prototype-integration/core-rc-manifest.schema.json",
        "git_blob": "55bd73e21f5c008bad0dadf7de112f53a6a7ba89",
        "sha256": "72e8c083dad691496b3505aef6cb0ab81f437c3ace8525954d84ed794c113a0f"
      },
      {
        "id": "validator",
        "path": "scripts/validate-core-rc-manifest.cjs",
        "git_blob": "a6c8f1196c0b0630f38b642ec8650b066b4ed720",
        "sha256": "c34b080fac99a9700e48b812d052e62821a200c1bdd88214e159ece3fef315ce"
      }
    ]
  },
  "toolchains": [
    {
      "name": "buf",
      "version": "1.47.2",
      "source": "sdk/generation/go.mod",
      "status": "declared"
    },
    {
      "name": "docker-compose",
      "version": "2.39.1",
      "source": "required gate runner image",
      "status": "declared"
    },
    {
      "name": "go",
      "version": "1.25.8",
      "source": "go.mod",
      "status": "declared"
    },
    {
      "name": "helm",
      "version": "3.18.6",
      "source": "required gate runner image",
      "status": "declared"
    },
    {
      "name": "node",
      "version": "20.19.4",
      "source": ".github workflow control",
      "status": "declared"
    },
    {
      "name": "node",
      "version": "24.12.0",
      "source": "required gate runner image",
      "status": "declared"
    },
    {
      "name": "node",
      "version": "24.12.0",
      "source": "sdk/ts/package.json volta",
      "status": "declared"
    },
    {
      "name": "pnpm",
      "version": "10.28.2",
      "source": ".github workflow control",
      "status": "declared"
    },
    {
      "name": "python",
      "version": "3.11.9",
      "source": ".github workflow control",
      "status": "declared"
    }
  ],
  "artifact_groups": [
    {
      "id": "lockfiles",
      "status": "available",
      "selection": {
        "included_path_prefixes": [],
        "included_file_patterns": [
          "**/go.sum",
          "**/pnpm-lock.yaml",
          "**/package-lock.json"
        ],
        "excluded_path_patterns": [],
        "minimum_file_count": 11,
        "expected_file_count": 11
      },
      "file_count": 11,
      "sha256": "c5b80770179ed70536e6503543faa9d41cb4ce36c4def375e87cdef55480e5c8",
      "blocker_id": null
    },
    {
      "id": "modules",
      "status": "available",
      "selection": {
        "included_path_prefixes": [],
        "included_file_patterns": [
          "**/go.mod",
          "**/package.json"
        ],
        "excluded_path_patterns": [],
        "minimum_file_count": 17,
        "expected_file_count": 17
      },
      "file_count": 17,
      "sha256": "a86a9b6fa1c5ed1709fc908aa2185d874e9a0596106ca6fe18de96c5ffcf2c61",
      "blocker_id": null
    },
    {
      "id": "proto",
      "status": "available",
      "selection": {
        "included_path_prefixes": [],
        "included_file_patterns": [
          "**/*.proto"
        ],
        "excluded_path_patterns": [],
        "minimum_file_count": 249,
        "expected_file_count": 249
      },
      "file_count": 249,
      "sha256": "2b80290cf11ebfca7f2fbaeb5e54306a41b81beb5359ef81a9fc9d6b84b20141",
      "blocker_id": null
    },
    {
      "id": "openapi",
      "status": "available",
      "selection": {
        "included_path_prefixes": [
          "openapi/"
        ],
        "included_file_patterns": [
          "**/*openapi*.json",
          "**/*openapi*.yaml",
          "**/*openapi*.yml",
          "**/*swagger*.json",
          "**/*swagger*.yaml",
          "**/*swagger*.yml"
        ],
        "excluded_path_patterns": [],
        "minimum_file_count": 10,
        "expected_file_count": 10
      },
      "file_count": 10,
      "sha256": "c37a740f9c34a98ab7866204e7eb8c2187340b4e5f57f9cfec9583dc055231c5",
      "blocker_id": null
    },
    {
      "id": "sdk",
      "status": "available",
      "selection": {
        "included_path_prefixes": [
          "sdk/go/",
          "sdk/ts/src/generated/"
        ],
        "included_file_patterns": [],
        "excluded_path_patterns": [],
        "minimum_file_count": 1508,
        "expected_file_count": 1508
      },
      "file_count": 1508,
      "sha256": "fa5089692121d1f61c28df693d404afbc8c6008ad7b48f67d367979917ff5249",
      "blocker_id": null
    },
    {
      "id": "model",
      "status": "partial",
      "selection": {
        "included_path_prefixes": [
          "models/",
          "ml/training/model/"
        ],
        "included_file_patterns": [],
        "excluded_path_patterns": [],
        "minimum_file_count": 13,
        "expected_file_count": 13
      },
      "file_count": 13,
      "sha256": "b13cfa38d4c9f52ef7fdb47249b20db8aafcf83617e85bd5dd866081c1c25543",
      "blocker_id": "production-model-artifacts-unavailable"
    },
    {
      "id": "chart",
      "status": "available",
      "selection": {
        "included_path_prefixes": [
          "deploy/slurm/slurm-cluster/"
        ],
        "included_file_patterns": [],
        "excluded_path_patterns": [
          "**/__pycache__/**",
          "**/.pytest_cache/**",
          "**/*.pyc"
        ],
        "minimum_file_count": 15,
        "expected_file_count": 15
      },
      "file_count": 15,
      "sha256": "e516c3e0a0cfba6b71473a3bc75bd287a475830438c918ab9bbfb993196258fa",
      "blocker_id": null
    }
  ],
  "control_artifacts": [
    {
      "id": "migration_inventory",
      "path": "_docs/ralph/prototype-integration/migration-inventory.json",
      "sha256": "d625558ab2f018c1b603cce40bbd351110c8441b24397c13819c00cebae007b1",
      "status": "dependency_blocked"
    },
    {
      "id": "required_gate_matrix",
      "path": "_docs/ralph/prototype-integration/required-gate-matrix.json",
      "sha256": "1eefd1fb89e9af3a1d0c1c6dfe81523a4b8749671f145fcbf0488bda086632fb",
      "status": "dependency_blocked"
    },
    {
      "id": "slurm_inventory",
      "path": "_docs/ralph/prototype-integration/slurm-chart-inventory.json",
      "sha256": "f3dcb8c332cedee06e950c774822d2b482f5a2a13e84f6132eb488a4e0473519",
      "status": "blocked"
    },
    {
      "id": "slurm_report",
      "path": "_docs/ralph/prototype-integration/slurm-chart-semantic-report.json",
      "sha256": "cf619b8ec32834f2cb1b4ba3850842d8253fb8d6d7714324ba5787c678ac87a8",
      "status": "blocked"
    },
    {
      "id": "model_provenance",
      "path": "_docs/ralph/prototype-integration/model-provenance.json",
      "sha256": "90e506192e849a4a555cf29d3bf8d37970981beaf31d966aea1832f437752508",
      "status": "dependency_blocked"
    },
    {
      "id": "ai_production_policy",
      "path": "_docs/ralph/prototype-integration/ai-production-policy.json",
      "sha256": "7df63a18a24e8b35ad69c21aed6fa583ff5589c2ddc1ea0830ca69f4b18e12b4",
      "status": "blocked"
    },
    {
      "id": "ai_biometric_security_gates",
      "path": "_docs/ralph/prototype-integration/ai-biometric-security-gates.json",
      "sha256": "c6fdb50abff205ddab61fedbc209fffd4b62b8f16a592e1d2a6f9bb2d5fd56d1",
      "status": "blocked"
    },
    {
      "id": "fund_route_inventory",
      "path": "_docs/ralph/prototype-integration/fund-route-inventory.json",
      "sha256": "ddb2b020a8bef05dc162b4a8d0b5ef64da37ab165b11782729e0606c195a2850",
      "status": "dependency_blocked"
    },
    {
      "id": "generated_contract_inventory",
      "path": "_docs/ralph/prototype-integration/generated-contract-inventory.json",
      "sha256": "9f8de2a05636f3f928db61f86320d59dfc50e451ea1a9477482c80e959e0cf3d",
      "status": "dependency_blocked"
    },
    {
      "id": "intake_epoch",
      "path": "_docs/ralph/prototype-integration/epochs/epoch-2.json",
      "sha256": "71c390b644564ece2d9fa92f88c83a228c166759dae4bcd37349635dbbb88d62",
      "status": "open"
    },
    {
      "id": "intake_tag_observation",
      "path": "_docs/ralph/prototype-integration/epochs/epoch-2-tag-observation.json",
      "sha256": "a89a25e24921f9568034a2d9d2434a1c1c7163b72c6328c9437da6238580a5fe",
      "status": "blocked"
    }
  ],
  "migrations": {
    "status": "dependency_blocked",
    "inventory_path": "_docs/ralph/prototype-integration/migration-inventory.json",
    "migration_count": 13,
    "unavailable_producer_count": 4,
    "blocker_id": "producer-migration-handoffs-unavailable"
  },
  "required_gates": {
    "status": "dependency_blocked",
    "matrix_path": "_docs/ralph/prototype-integration/required-gate-matrix.json",
    "category_count": 11,
    "blocked_category_count": 11,
    "blocker_id": "required-gates-dependency-blocked"
  },
  "slurm": {
    "status": "blocked",
    "inventory_path": "_docs/ralph/prototype-integration/slurm-chart-inventory.json",
    "report_path": "_docs/ralph/prototype-integration/slurm-chart-semantic-report.json",
    "report_status": "blocked",
    "blocker_id": "slurm-production-evidence-unavailable"
  },
  "model_provenance": {
    "status": "dependency_blocked",
    "path": "_docs/ralph/prototype-integration/model-provenance.json",
    "sbom_status": "dependency_blocked",
    "production_weights_status": "dependency_blocked",